topic	tweet_id	tweet_url	tweet_text	class_label
COVID-19	1370540361525891072	http://twitter.com/user/status/1370540361525891072	This is a global pandemic. It requires a global response. Our best chance of all staying safe is to ensure COVID-19 vaccines, tests and treatment are available for everyone, everywhere. #AFairShot https://t.co/9t35cdem1M https://t.co/PobA4mdwwy	0
COVID-19	1370133415845101568	http://twitter.com/user/status/1370133415845101568	Tanzania's president, John Magufuli, relished mocking the idea of a coronavirus pandemic. He railed against masks, social distancing and vaccines. Now there is speculation he is sick with the virus. He hasn't been seen in public for almost two weeks. https://t.co/tYrESc1rnx	0
COVID-19	1369364638786289676	http://twitter.com/user/status/1369364638786289676	1. The Queen promotes vaccines 2. Prince Charles and William promote the World Economic Forum 3. Prince William claims they're too many people 4. Prince Philip believes they're too many people 5. Covid vaccine sticker has the Crown logo on it Wakey, wakey people! https://t.co/kknsqX88YY	1
COVID-19	1369264249072218113	http://twitter.com/user/status/1369264249072218113	Civil rights activist and United Farm Workers Co-founder @DoloresHuerta tells @Lawrence that it’s important that states prioritize farmworkers for the Covid-19 vaccines because “these are the people that are putting the food on your table.” https://t.co/F3HNeNHnlg https://t.co/0gdLY5Axgz	0
COVID-19	1368580233864114184	http://twitter.com/user/status/1368580233864114184	new and important: Russian disinfo campaign aims to undermine confidence in US covid vaccines, via ⁦@mgordonwsj⁩ ⁦@dnvolz⁩ https://t.co/CLcNKFR1lq	1
COVID-19	1367469593707634691	http://twitter.com/user/status/1367469593707634691	Netanyahu says that the vaccines are safe and mocks those who expressed legitimate concerns about their safety. Ok, Bibi. I trust you on this, but only if you take the same Pfizer Covid vaccine that was injected to those who died after the shot, not the one you got on TV. https://t.co/XC5IqPCcwq	0
COVID-19	1367208427903021056	http://twitter.com/user/status/1367208427903021056	We found people who were denied COVID vaccines—even when they brought ID that fit a site’s stated rules. These policies are inconsistent, sometimes arbitrary. Walgreens, Albertsons and LA now say they're working to ensure qualified people aren’t rejected. https://t.co/x38ndAU62U	1
COVID-19	1366548796549656576	http://twitter.com/user/status/1366548796549656576	COVID-19 vaccines: safe, effective, and probably prevent transmission as well as disease A lot of good news ping @CaulfieldTim @MackayIM @TheSciBabe https://t.co/4dMA9OhXgE	1
COVID-19	1369374640066473984	http://twitter.com/user/status/1369374640066473984	In Pakistan, mistrust of Covid-19 vaccines is driven by a murky legacy of American intervention and involvement in the country, and the hunt for Bin Laden.  My latest, for @VICEWorldNews. https://t.co/w7kAKdYKzz	0
COVID-19	1368561522025263115	http://twitter.com/user/status/1368561522025263115	#LargestVaccineDrive #Unite2FightCorona Covid vaccines are almost 100% efficacious in preventing Covid deaths, severe Covid disease and complications. - Dr Rakesh Kumar, Former Joint Secretary, Ministry of Heath and Family Welfare, Government of India https://t.co/S42jhxT3c7	0
COVID-19	1366894876927827968	http://twitter.com/user/status/1366894876927827968	More patience = less patients. Vaccines are here and many more are coming, but the vast majority of people don’t have vaccine-induced immunity yet. https://t.co/Qb5wqzcseQ	0
COVID-19	1367214107619971078	http://twitter.com/user/status/1367214107619971078	Great to see the first vaccines through UK-supported #COVAX now in Kenya, as well as other countries across Africa. I saw first-hand how the UK and Kenya are working together to further develop the COVID-19 vaccine through partnership between @KEMRI_Kenya and @OxfordVacGroup https://t.co/lp1FE4SLvG	0
COVID-19	1368297528156950532	http://twitter.com/user/status/1368297528156950532	🔥CDC update🔥 If a person has received one dose of mRNA vaccine and the second is contraindicated or not available , the J&amp;J vaccine may be considered — but should not be given until at least 28 days after the mRNA vaccine https://t.co/lnj6BKxWtL	0
COVID-19	1369001013840027648	http://twitter.com/user/status/1369001013840027648	Luckily in the USA, Federal Law prohibits employers and others from requiring vaccination with a COVID vaccine distributed under an Emergency Use Authorization: https://t.co/LzxSIkER7Y FDA clearly states that these are investigational vaccines. See p 9: https://t.co/rcgMqwiuDC	0
COVID-19	1366309036375699463	http://twitter.com/user/status/1366309036375699463	Philippine General Hospital Director Dr. Gerardo Legaspi urges Filipinos to trust in science and set aside other judgments that they may have on vaccines. Dr. Legaspi was the first healthcare worker to receive COVID-19 jab in the country. https://t.co/GqFOuxJKYR	0
COVID-19	1366075801951752192	http://twitter.com/user/status/1366075801951752192	One woman came to get vaccinated by the Black Doctors Consortium the same night her mother died from COVID. We put a circle around her, and we talked to her, and we prayed with her, and we gave her the vaccine. https://t.co/7WAUmIdrdn	0
COVID-19	1370983809328553991	http://twitter.com/user/status/1370983809328553991	According to the New York Times,Chinese Covid-19 vaccines top safety rankings: 1. Sinopharm (China) 2. Sinovac (China) 3. Kexing (China) 4. Can Sino (China) 5. AstraZeneca (UK) 6. Pfizer (USA and Germany) 7. Modena (USA) @Solwayo1 @drjaytee87 https://t.co/RjZMs9HmtU	0
COVID-19	1369921979696869377	http://twitter.com/user/status/1369921979696869377	Billboards Put Up In Canada Thanking India And PM Modi For Supplying Covid-19 Vaccines https://t.co/ILnZ53XLdj	0
COVID-19	1368407480850472961	http://twitter.com/user/status/1368407480850472961	Barbados PM thanks PM Modi for supply of made-in-India COVID-19 vaccines. #OurVaccineOurPride https://t.co/uac2MuZCXc	0
COVID-19	1367281553651478532	http://twitter.com/user/status/1367281553651478532	Good to meet with @POTUS, @VP, and a bipartisan group to brainstorm how we take a quantum leap forward to beat devastating diseases like cancer and Alzheimer’s. We must leverage the scientific power we’ve seen in the development of COVID-19 vaccines by experts like those at @NIH.	0
COVID-19	1369304097397088261	http://twitter.com/user/status/1369304097397088261	🚨While thousands of Arizona seniors wait for vaccines, the Biden Administration and Democrats in Congress are refusing to prioritize Americans over illegal immigrants for COVID-19 vaccinations. READ my op-ed in @FoxNews below⬇️ https://t.co/BbrWVO9tsa	1
COVID-19	1368546922651410433	http://twitter.com/user/status/1368546922651410433	Hundreds of fake #COVID19 vaccines seized in #SouthAfrica. Some 400 ampoules - equivalent to about 2,400 doses - containing the fake vaccine, fake masks were found at a warehouse in Johannesburg. 3 Chinese nationals and a Zambian national were arrested https://t.co/twIHeiwhgj https://t.co/X1rA1dGZ5p	0
COVID-19	1370024578274058249	http://twitter.com/user/status/1370024578274058249	“...concerns that the approval of the COVID-19 vaccines by the EMA was premature &amp; reckless, and that the administration of the vaccines constituted &amp; still does constitute “human experimentation”, which was &amp; still is in violation of the Nuremberg Code.” https://t.co/5vutA3eRFI	1
COVID-19	1369806173340233731	http://twitter.com/user/status/1369806173340233731	A B.1.351 variant update 1. Report from Zimbabwe, became dominant after SA https://t.co/XkaMTN4fq3 @LancetMicrobe 2. New @moderna_tx vaccine targets it https://t.co/ttpX4o1HhJ @Loftus May not be needed in light of this pattern w/o vaccination and preserved efficacy of vaccines https://t.co/F1dJ1ptrgQ	0
COVID-19	1369481347463401474	http://twitter.com/user/status/1369481347463401474	Vaccine appointments are still available at City-run sites. While Dodger Stadium is our biggest location, we have other sites accessible without a car — including our new @USC site, Lincoln Park and San Fernando Park. Visit https://t.co/naMSTBoW89 to make an appointment today. https://t.co/mnJ8bZKMSo	0
COVID-19	1367826668564459521	http://twitter.com/user/status/1367826668564459521	Ghana has taken delivery of 50,000 Covid-19 vaccines from the Government of #India. The vaccines which arrived in the country on Friday March 5, 2021, was received by Minister for @GhanaMFA, Hon. @AyorkorBotchwey and the Minister for Health Hon. Kwaku Agyeman-Manu https://t.co/KmdtevkdPG	0
COVID-19	1361697981087457284	http://twitter.com/user/status/1361697981087457284	Covid does not respect borders. We cannot allow it to spread unchecked and mutate. Biden must help the world quickly manufacture vaccines. If we don't act, a dose may not reach everyone around the world until 2024. https://t.co/0SVmh9Lb6y	0
COVID-19	1370037188281401349	http://twitter.com/user/status/1370037188281401349	There might be no link between deaths following taking Covid vaccines and taking these vaccines, but these deaths demonstrate that in medicine it's better to avoid absolutist language, such as 'this or that vaccine is absolutely safe'. No medical intervention is 100% safe.	0
COVID-19	1369704009854971904	http://twitter.com/user/status/1369704009854971904	Information to help you learn about the Johnson &amp; Johnson, Pfizer-BioNTech and Moderna COVID-19 vaccines. Bottom line: They are all very effective in protecting against COVID-19. Get the first vaccine that becomes available to you. via @UofUHealth https://t.co/boNXZWE6E5 https://t.co/ywbt06tm6K	0
COVID-19	1366399588375142401	http://twitter.com/user/status/1366399588375142401	Netanyahu focused on sending vaccines to friendly dictators around the world &amp; refused to help vaccinating the West Bank. Now a wave of covid-19 there is crossing over in to Israel and jeopardizing his vaccination-election strategy. My @haaretzcom analysis https://t.co/CUIteSmYEz	1
COVID-19	1370494155420528641	http://twitter.com/user/status/1370494155420528641	In case you missed this exciting news, Texans age 50 and up will be eligible to sign up for a COVID-19 vaccine starting this coming Monday. We're getting closer every day to beating this virus. #MaskUpATX to keep the spread low while we wait for more vaccines. https://t.co/sJGcivkcNp	0
COVID-19	1370016190832197643	http://twitter.com/user/status/1370016190832197643	America's Frontline Doctors Call on the Government and the Commercial Airline Industry to Abandon Requiring COVID-19 Vaccines https://t.co/NCaUJ7RkZE	0
COVID-19	1369458024604176394	http://twitter.com/user/status/1369458024604176394	Many thanks ⁦@thenewsoncnbc⁩ for hosting me this evening on how we adapt some very promising #covid vaccines to a weak infrastructure and health system for adult vaccine delivery. The good news: Biden Admin working hard to expand access. The bad news: the B.1.17 variant https://t.co/Lq7zz5atjf	0
COVID-19	1366770150586933248	http://twitter.com/user/status/1366770150586933248	There is absolutely no evidence, and no theoretical reason, that any of the vaccines can affect the fertility of women or men. This document by @ARCScientists and @BritFertSoc explains all you need to know about the COVID-19 vaccine and fertility 👇 https://t.co/3tI9XCZGBB	1
COVID-19	1359655390192009216	http://twitter.com/user/status/1359655390192009216	The COVID-19 mRNA vaccines are one success in nanomedicine. Our Dr. Betty Kim shares how nanomedicine is being explored to treat cancer: https://t.co/zPLF8ld7p7 @BettyKimLab #COVIDVaccine #EndCancer	0
COVID-19	1371008195821469703	http://twitter.com/user/status/1371008195821469703	Vaccine propaganda in action! A fresh report by @SecureDemocracy shows, among other, Kremlin-affiliated accounts significantly more often spread negative news about the Pfizer and Moderna vaccines, often containing #disinformation https://t.co/WT5LZeOGIN https://t.co/XBJHo5WDrE	1
COVID-19	1369554364432519174	http://twitter.com/user/status/1369554364432519174	What you should know about the AstraZeneca vaccine: You will still be able to contract COVID-19 even after vaccination. However, these vaccines lessen the severity of the infection and reduce the risk of death due to Covid-19. @nbstv #NBSUpdates 📸- @RAkwesiga https://t.co/Npu99LVois	1
COVID-19	1369458286291021832	http://twitter.com/user/status/1369458286291021832	Across the country, more and more people are getting vaccinated every day. Today, Prime Minister Justin Trudeau updated Canadians on #COVIDVaccine deliveries. Learn more about the rollout of #COVID19 vaccines in Canada: https://t.co/sowNpK3H01 https://t.co/Kx3H7jRXC7	0
COVID-19	1367127972633866243	http://twitter.com/user/status/1367127972633866243	Safe and effective #COVID19 vaccines will be available to everyone in Canada. The GoC is working with prov. and terr. to support their vaccination programs. You can track the vaccine rollout in your province or territory here https://t.co/KQ9mmjyBRJ #COVIDVaccine #VaccinesWork https://t.co/wcbkT10KIr	0
COVID-19	1365057111139487751	http://twitter.com/user/status/1365057111139487751	It's time for a proper count of the damage and death caused by the #Covid vaccines in Ontario. Officials are covering up the true toll. https://t.co/HeEEQ26ZGd	1
COVID-19	1370043269569261577	http://twitter.com/user/status/1370043269569261577	The COVID-19 vaccine means hope. It’s a way to protect you, your family, and your way of life. Right now, the vaccines are available to millions of Americans, and soon it will be available to everyone. https://t.co/0O1DfYgkah	0
COVID-19	1369561971830493184	http://twitter.com/user/status/1369561971830493184	Urgent need to ensure fair and equitable distribution of #COVID19 vaccines. Our @ifrc plan focuses on ensuring that, once received, vaccines reach those who need them most. We need to quickly fill this deadly gap in global immunization policy and funding. https://t.co/tkmdG4IDjA	0
COVID-19	1368817966175952897	http://twitter.com/user/status/1368817966175952897	Don’t become victim of conspiracy theories and lies about #COVID vaccines. We’ve been taking vaccines on polio, yellow fever for years, what is difference. “If you don’t have what to preach, stop preaching. Stop making a whole sermon out of a vaccine - Archbishop Duncan Williams https://t.co/Jl238sTguv	0
COVID-19	1360999763576057856	http://twitter.com/user/status/1360999763576057856	#Rotary member Dr. Pavithra, PhD. Microbiology and Coronavirus, debunks nine myths related to #Covid19 vaccines. https://t.co/3MB9hKs1t4 #RotaryResponds	0
COVID-19	1370224319025061889	http://twitter.com/user/status/1370224319025061889	“Virginia Kroger now says it administered ‘empty syringes’ instead of COVID-19 vaccines” https://t.co/hVYUnuBr51	1
COVID-19	1369393886255267853	http://twitter.com/user/status/1369393886255267853	Covid 19 vaccines at #Longsight mosques. Available before and after Jum'a prayers. Pls check poster for info. Pls share widely. https://t.co/7lxaKa8Xdf	0
COVID-19	1369941633538621440	http://twitter.com/user/status/1369941633538621440	https://t.co/BYT6fK2maB So another group of scientific experts are openly warning about the safety of these rushed experimental vaccines. They question why there are still mass outbreaks and deaths from Covid in nursing homes, despite the fact the vaccine has been administered.	1
COVID-19	1369426903862493193	http://twitter.com/user/status/1369426903862493193	Access to vaccines continues to increase, but more must be done so everyone can be protected. We must also improve COVID-19 treatment options and access to care. https://t.co/PJwDvNhwoU	0
COVID-19	1368567953646641152	http://twitter.com/user/status/1368567953646641152	The COVID-19 vaccines are all effective Dr. Anthony Fauci affirms to the Black community, and all concerned about taking the single-dose vaccine. Dr. Fauci and Tiffany Cross discuss more ways you can fight #COVI19: https://t.co/F3kqSTzRqS via @CrossConnection	0
COVID-19	1368294155907080194	http://twitter.com/user/status/1368294155907080194	Attn Tampa educators, including USF employees...I just got my covid vaccine at the greyhound track. Things are moving super fast here. Like 45 minutes from start to finish. Bring FL ID and USF ID. All ages, not just 50+. #CovidVaccine	0
COVID-19	1368230731395198976	http://twitter.com/user/status/1368230731395198976	Death Rates Skyrocket in Israel Following Pfizer Experimental COVID 'Vaccines' March 2, 2021 “This is a new Holocaust” – Engineer Haim Yativ and Dr. Seligmann https://t.co/8QMMlAl7n9	1
COVID-19	1366691551259287554	http://twitter.com/user/status/1366691551259287554	Pfizer has demanded sovereign assets as collateral and wanted Argentina to put its bank reserves, military bases and embassy buildings as security against any future claims against them for the covid vaccine https://t.co/5eceNU2EPO	1
COVID-19	1371104064373669888	http://twitter.com/user/status/1371104064373669888	please remember that many countries will not have access to the vaccines for Covid-19 for a while and back to normal will not happen for many more months, if not years, than in countries like the US	0
COVID-19	1368970498919571456	http://twitter.com/user/status/1368970498919571456	So my mom has been in the hospital since Friday. She had her second Covid vaccine 10 days ago. Guess what, the vaccine CAUSED her to get meningitis. No joke. And get this, my stepdad's mom had the vaccine 2 weeks ago, she had a stroke today. #CovidVaccine Don't do it!	1
COVID-19	1368630387254173699	http://twitter.com/user/status/1368630387254173699	If anyone asks if you’re getting the vaccine, just tell them, “I’m waiting for them to be approved by the FDA.” If they say it already is, gently correct/inform them that the vaccines are only authorized for emergency use! https://t.co/WUVglxv7Cu Tips from No Agenda	0
COVID-19	1368615140149633034	http://twitter.com/user/status/1368615140149633034	The SVR and FSB attacks on our confidence in Pfizer Inc and other Western vaccines are among the least of their attacks. All three of these publications are anti-US anti-democracy Russian operations. https://t.co/IUQQgNPpKp	0
COVID-19	1347656835868860416	http://twitter.com/user/status/1347656835868860416	Thanks to Governor Cuomo's tearing up of COVID vaccination plans to micromanage NYC and reverse his back to back previous failures, today 66% of our vaccines are not being used due to systemic distribution failures. Some have expired. https://t.co/gahkRnaWaT	1
COVID-19	1370175983895126019	http://twitter.com/user/status/1370175983895126019	RFK Jr.'s anti-vaccination film repeats misrepresentations about vaccines, generally, and exploits historical cases of unethical medical conduct in the Black community to suggest without evidence that COVID-19 vaccines are unsafe. #scicheck https://t.co/tvCpmUmt4z	0
COVID-19	1369908466869964805	http://twitter.com/user/status/1369908466869964805	LOOK: Health Secretary Francisco Duque III visits the UST Hospital to inspect its Covid-19 vaccination drive and administer vaccines to some medical workers. (Photos from PTV) https://t.co/6nrVgRVn86	0
COVID-19	1368996682424287247	http://twitter.com/user/status/1368996682424287247	111 rural counties have 0 pharmacies that can give covid-19 vaccines. This has left hundreds of thousands of vulnerable Americans struggling to find vaccines -- and could ultimately prolong the pandemic in many hard-hit rural regions. https://t.co/6hz7OhOJjZ	0
COVID-19	1368977363653038081	http://twitter.com/user/status/1368977363653038081	The L.A. teachers union is balking at a return to in-person classes, even as California offers Covid-19 vaccines and billions in aid https://t.co/1eGSQ7K2xu	0
COVID-19	1368678128986419200	http://twitter.com/user/status/1368678128986419200	The Northern Rivers region is the anti-vaxx capital of Australia and the most high profile people casting doubt on COVID19 vaccines are Pete Evans, Clive Palmer and Craig Kelly but sure, I guess we can frame the problem as the ethnics again. https://t.co/s0bbhiSbQR	0
COVID-19	1370686498752901120	http://twitter.com/user/status/1370686498752901120	UK: 35 people deaf and 25 blind after taking mRNA vaccine shot The Yellow Card scheme tracking potential vaccine injuries has flagged a combined 191,832 individual adverse events, or side effects, related to COVID vaccines. https://t.co/SZeTu4CSvC	1
COVID-19	1369297270760501252	http://twitter.com/user/status/1369297270760501252	The @britishredcross has launched a campaign to tackle vaccine hesitancy. Their latest video features families talking openly about the covid vaccines. Let's all join in and have more informed conversations with loved ones to keep each other protected. https://t.co/HvflxGgCHS	0
COVID-19	1368708037754707969	http://twitter.com/user/status/1368708037754707969	The #AmericanRescuePlan is key to winning the battle against COVID-19—deploying more vaccines, getting kids back to school more quickly &amp; safely, and extending lifelines to those facing severe hardship. Read more about how this relief will help Marylanders:https://t.co/1juqz26Dfe	0
COVID-19	1368314195834462209	http://twitter.com/user/status/1368314195834462209	88% of Illinois #COVID deaths over the past month were aged 60 and over. However, only 44% of the vaccines administered have gone to the elderly. More lives would be saved if more of the vaccine were going to those who are dying the most. https://t.co/5uy11EEEog #twill #covid19 https://t.co/C2LzydylD5	0
COVID-19	1366563749998432257	http://twitter.com/user/status/1366563749998432257	Time for the Philippines to completely turn to the East for its COVID-19 vaccine supplies now that some Western pharmaceutical companies have become too greedy and the Western countries have hoarded the bulk of the supply of the vaccines made by Western pharmaceutical companies.	0
COVID-19	1364931539272933376	http://twitter.com/user/status/1364931539272933376	A reminder of why Indigenous people are being prioritized for vaccines. In addition to the disproportionate rates of infection, hospitalization and ICU stay, FN people are more likely to die at a younger age from #covid in Manitoba. https://t.co/bvADPDUSQ5 https://t.co/cRLT2LNWxy	0
COVID-19	1369663309889277955	http://twitter.com/user/status/1369663309889277955	Dr. Williams Mobolaji Afolabi, our COVID 19 Case Management Pillar Lead, and Mrs. Tosin Adeleye, the Chief Nursing Officer, were the first health workers to receive their Covid-19 vaccines in Ekiti State. From here to herd immunity. https://t.co/yPneimqv17	0
COVID-19	1369601495054901250	http://twitter.com/user/status/1369601495054901250	Pleased to announce that following the delivery of the Oxford-AstraZeneca COVID-19 vaccines to Osun, I, this morning, received my first jab of the vaccine. I was vaccinated by the State Incident Manager on Covid-19 and CMD, Uniosun Teaching Hospital, Prof. Peter Olaitan. https://t.co/sK5lboZrTh	0
COVID-19	1367154420920672256	http://twitter.com/user/status/1367154420920672256	COVID-19 vaccines are the most powerful way to protect ourselves and those we love. Do your part and get vaccinated as soon as it’s available. Until then, please continue to wash your hands, maintain physical distance, and wear a mask. https://t.co/Y6nnlOk5Yv https://t.co/pQpkEsVU6y	0
COVID-19	1366835388120137728	http://twitter.com/user/status/1366835388120137728	I recently spent an afternoon at a @UCSF site in San Francisco's Mission District, administering COVID vaccines. Great to be a small part of this important effort to help CA communities understand the vaccine and get access for themselves &amp; their families. https://t.co/rLei2l6VE7	0
COVID-19	1359561519089016834	http://twitter.com/user/status/1359561519089016834	In any year, UNICEF reaches almost half of the world's children with vaccines. When it comes to distributing doses for COVID-19, we were made for this. Here's how UNICEF and partners are helping get vaccines to those who need it most. Because no one is safe until we're all safe. https://t.co/UkVqcdq53k	0
COVID-19	1370787310049099777	http://twitter.com/user/status/1370787310049099777	Just to let you know @DrMercyKorir, our political leadership are hoarding the vaccines for themselves, it's for their loved ones, families and mistresses. Another scandal loading, over to you @PurityMwambia, @DennisOkari @johnallannamu @njerikan COVID-19 vaccines scandal loading https://t.co/pFgMo36Ley	1
COVID-19	1369005778963726337	http://twitter.com/user/status/1369005778963726337	Some Black communities have been slow to accept the Covid-19 vaccines. Churches are taking on the tasks of dismantling stigma and distrust, and getting shots in arms. https://t.co/DuArf0G5WD - @NBCBLK	0
COVID-19	1367519088893919236	http://twitter.com/user/status/1367519088893919236	Interpol says thousands of doses of counterfeit COVID-19 vaccines have been seized in China and South Africa, with 84 suspects arrested https://t.co/JSW7QKiWhI	0
COVID-19	1365279506584379397	http://twitter.com/user/status/1365279506584379397	This week MEPs called on pharmaceutical companies to honour their contracts and rapidly roll out the Covid-19 vaccines. Watch the highlights below and check out → https://t.co/7iylHnsc7X https://t.co/ERxE9LyzSh	0
COVID-19	1370170273266335746	http://twitter.com/user/status/1370170273266335746	Sun: Denmark and Iceland are latest countries to suspend AstraZeneca CV vaccines amid fatal blood clot fears. Seven nations have now paused jabs while officials investigate blood clotting conditions in recently vaccinated people, including a death. https://t.co/LfrqHH8M2i	0
