topic	tweet_id	tweet_url	tweet_text	class_label
COVID-19	1359350943356174337	http://twitter.com/user/status/1359350943356174337	India's gift of 100,000 COVID-19 vaccines arrived Barbados earlier today. This was a very special moment for all Barbadians and I want to thank Prime Minister Modi for his quick, decisive, and magnanimous action in allowing us to be the beneficiary of these vaccines. https://t.co/cSCb40c2mt	0
COVID-19	1370008076489789440	http://twitter.com/user/status/1370008076489789440	As part of the ongoing nationwide vaccination rollout that has seen more than 230,000 people vaccinated, President Kagame and First Lady Jeannette Kagame received their #COVID-19 vaccines at King Faisal Hospital. https://t.co/OylatTad9W	0
COVID-19	1367726730044207104	http://twitter.com/user/status/1367726730044207104	Pleased to receive 50,000 doses of Covid-19 vaccines from India 🇮🇳this morning. Govt of Rwanda 🇷🇼 is grateful to the Govt of India 🇮🇳 and other partner countries for their valuable contribution to the fight against #COVID19 @DrSJaishankar	0
COVID-19	1369888483414712322	http://twitter.com/user/status/1369888483414712322	Four former presidents have banded together for two national ad campaigns released Thursday designed to drive trust in COVID-19 vaccines — and they're all pictured getting inoculated against the virus https://t.co/nG9V6jalhl	0
COVID-19	1368585187500691461	http://twitter.com/user/status/1368585187500691461	WSJ: All three of Russia's main intelligence services (SVR, FSB, and GRU) ran fake news sites and phony social media accounts to spread misinformation about Pfeizer and Moderna vaccines in an attempt to undermine confidence in them. https://t.co/t3kmCYvBFs via @WSJ	1
COVID-19	1368249497734713346	http://twitter.com/user/status/1368249497734713346	Joel Embiid will donate his $100K ASW earnings to three homeless shelters in Philly to help provide: -Meals -Clothing items -Treatment and care for those who get COVID-19 vaccines -Funds for a summer camp -Shelter for 300+ teens -Support for formerly homeless families 🙏 https://t.co/MlYyAC3E8j	0
COVID-19	1365324501475594243	http://twitter.com/user/status/1365324501475594243	“Action can be taken now to ensure that Canada can produce its own vaccines without the need to solely rely on international partners.” @Mossmanlab makes the case for @MacGlobalNexus Fitzhenry Vector Lab to produce COVID-19 vaccine doses for all Canadians. https://t.co/J3Nvb5faq6	0
COVID-19	1350907284575043584	http://twitter.com/user/status/1350907284575043584	Those who falsely claim Vaccines are 100% safe and who laugh at anti-vaxxers will be dependent on those who refuse to tell the official lies to say that wide-spread vaccination *is* critical. 23 die in Norway after receiving COVID-19 vaccine: https://t.co/eN10HwZvqW via @nypost	1
COVID-19	1370453239309680640	http://twitter.com/user/status/1370453239309680640	Additionally, beginning Monday, April 5, all Michiganders age 16+ who were not previously eligible will be eligible to receive a vaccine. This is exciting news, and I urge all eligible Michiganders to get one of the three safe and effective COVID-19 vaccines.	0
COVID-19	1367517694279393282	http://twitter.com/user/status/1367517694279393282	The EU and Italy have blocked AstraZeneca’s COVID-19 vaccine shipment destined for Australia after the drug manufacturer failed to deliver the doses it promised Europe. https://t.co/GEMOlMwhkW	0
COVID-19	1367555102291148801	http://twitter.com/user/status/1367555102291148801	This week, team @OSUWexMed administered some of the first Johnson &amp; Johnson COVID-19 vaccines -- the only single-dose shot authorized by the FDA. We're working to ramp up its production because a third safe and effective vaccine means we can vaccinate more people more quickly. https://t.co/fAdDViMlg8	0
COVID-19	1365385808316944386	http://twitter.com/user/status/1365385808316944386	NC is ranked #1 in the US for vaccinations of adults over 65. Way to go NC! I am so proud of our vaccine providers across North Carolina, and the amazing team at @NCDHHS, for all their hard work getting vaccines into arms quickly and equitably.   https://t.co/muMgDxcMN9	0
COVID-19	1367295604703993856	http://twitter.com/user/status/1367295604703993856	All three vaccines authorized in the U.S. — made by Johnson &amp; Johnson, Moderna, and Pfizer and BioNTech — greatly reduce the risk of getting Covid-19. They also have a high efficacy against more serious outcomes like hospitalization and death. See more: https://t.co/N1it9ZKnQW	0
COVID-19	1366074035348467712	http://twitter.com/user/status/1366074035348467712	In simulations, “getting people vaccinated sooner with a lower efficacy vaccine prevented many more Covid-19 cases, hospitalizations and deaths compared to waiting even just a month for a higher efficacy vaccine.” https://t.co/uu3OXX8zVk	0
COVID-19	1364402806992568320	http://twitter.com/user/status/1364402806992568320	The Navajo Nation has surpassed its goal of administering 100,000 COVID-19 vaccines by the end of February, a figure that represents over half of its residents. Our work to increase supply, increase places to get vaccinated, and increase vaccinators is making a difference.	0
COVID-19	1369998582435229696	http://twitter.com/user/status/1369998582435229696	CVS has nearly doubled the number of states where its pharmacies are offering Covid-19 vaccinations through Biden’s federal retail pharmacy program, CVS said in a statement. It is now offering Covid-19 vaccines in 29 states and Puerto Rico.	0
COVID-19	1369512362873589760	http://twitter.com/user/status/1369512362873589760	Alaska has become the first state to drop eligibility requirements for Covid-19 vaccines and allow anyone 16 or older who lives or works in the state to get a vaccine, Gov. Dunleavy says. https://t.co/32DSapyzsA	0
COVID-19	1370191018243465219	http://twitter.com/user/status/1370191018243465219	President Biden announced expanded anti-covid vaccines and that all adults will be eligible by May 1. My Cinco de Mayo birthday wish is now one shot vaccine and one shot tequila.	0
COVID-19	1365011945108176901	http://twitter.com/user/status/1365011945108176901	The good news! Rating agency Moody's projects India to grow at 13.7% in FY2022, up from 10.8% estimated earlier. The revised numbers came on the back of normalisation of activity and growing confidence in the market with the rollout of Covid-19 vaccines. https://t.co/lppBy9W8Bj	0
COVID-19	1369788331232493573	http://twitter.com/user/status/1369788331232493573	It was great to be in Sumterville today to announce a new drive-thru vaccination site which will provide 3,000 Johnson &amp; Johnson vaccines to Floridians 65 and older over the next three days. #SeniorsFirst. More here - https://t.co/H80UiLdFsp https://t.co/lxNOgW4tdp	0
COVID-19	1369591200093732864	http://twitter.com/user/status/1369591200093732864	We have reached an agreement with BioNTech-Pfizer for the supply of four million more doses of COVID-19 vaccines for EU countries in the next two weeks. This will help tackle coronavirus hotspots and facilitate free border movement. #StrongerTogether	0
COVID-19	1356605799766745090	http://twitter.com/user/status/1356605799766745090	In 1956, Elvis was vaccinated backstage at @EdSullivanShow, inspiring thousands to get the polio vaccination. With COVID-19 vaccines becoming available and many American's uncertain, three former presidents are talking about following in his footsteps. https://t.co/cdtuB0SsXH https://t.co/Du4HuyvmPF	0
COVID-19	1369988744728616965	http://twitter.com/user/status/1369988744728616965	India has provided over 481 lakh doses of Covid vaccines to various countries till March 4. Out of 481.06 lakh vaccine doses sent to various countries, 73.5 lakh doses have been supplied as grant assistance, 288.4 lakh on commercial basis and 119.16 lakh doses for COVAX.	0
COVID-19	1370046383458246659	http://twitter.com/user/status/1370046383458246659	WHOOPI RECEIVES COVID-19 VACCINE: Our @WhoopiGoldberg tells us she received her first shot of the coronavirus vaccine and encourages others to do the same: “Get the shot!” Get more information on COVID-19 vaccines: https://t.co/dGwgeZLEcy https://t.co/iaQtAbSAwf	0
COVID-19	1371118941460963331	http://twitter.com/user/status/1371118941460963331	Vaccines are extremely effective at preventing severe Covid illness and death, but no vaccine is perfect. Continue masking up.	0
COVID-19	1368703552546308099	http://twitter.com/user/status/1368703552546308099	Russian intelligence agencies have mounted a campaign to undermine confidence in Pfizer Inc.’s and other Western vaccines... https://t.co/vZEysfIJrt	1
COVID-19	1368561780142792705	http://twitter.com/user/status/1368561780142792705	Extent of damage to AstraZeneca vaccine’s perceived safety in Europe revealed % saying they would refuse this vaccine and wait for a diff one AstraZeneca 🇩🇪27% 🇫🇷22% 🇮🇹 23% 🇪🇸19% 🇬🇧2% Pfizer 🇩🇪6% 🇫🇷7% 🇮🇹 7% 🇪🇸5% 🇬🇧4% Moderna 🇩🇪12% 🇫🇷11% 🇮🇹 11% 🇪🇸6% 🇬🇧5% https://t.co/rppoUptxIO https://t.co/yY6rpEcxIJ	0
COVID-19	1366780368318312449	http://twitter.com/user/status/1366780368318312449	Unusual swelling caused by Covid-19 vaccines is being picked up on routine mammograms and other scans, radiologists say. Here's what you can do to avoid unnecessary worries about breast and other forms of cancer when you get your vaccination. https://t.co/BxXbkaAaib	1
COVID-19	1367820629886504961	http://twitter.com/user/status/1367820629886504961	An exciting day for us as #Uganda received the initial batch of 864,000 doses of AstraZeneca COVID-19 vaccines manufactured by the Serum Institute of India and shipped via the COVAX facility. Thank you to all who made this possible. https://t.co/g4AHCWnHzl	0
COVID-19	1369404118759055364	http://twitter.com/user/status/1369404118759055364	I’m pleased to announce that @CVShealth will soon begin administering COVID-19 vaccines at 76 additional @CVSpharmacy locations across our state, bringing the total number of CVS vaccination locations in FL to 157 in 30 counties. More info here - https://t.co/Y3jWFaWXlz https://t.co/SWeUrGzpVh	0
COVID-19	1369032423695081476	http://twitter.com/user/status/1369032423695081476	With three COVID-19 vaccines available and a steadily increasing supply, we are now able to open up eligibility to all phase 3 priority groups. New appointments for phase 3 will post to the portal at midnight. Learn more: https://t.co/fpMRXEua4n https://t.co/XmV50rjeU9	0
COVID-19	1367717174236839937	http://twitter.com/user/status/1367717174236839937	Globally, the latest vaccination rate is 6,582,835 doses per day, on average. ➡️At this rate, it will take an **4.7 years** to cover 75% of the population with a two-dose vaccine. And the inequality is widening. LMIC countries need #CovidVaccine faster. https://t.co/H9GZqslstq https://t.co/dkTKn2oQlh	0
COVID-19	1369629278053269507	http://twitter.com/user/status/1369629278053269507	Alaska makes vaccines available to those 16 and older, becoming first state to remove eligibility requirements https://t.co/BLWq3hZBeG	0
COVID-19	1368236350948970499	http://twitter.com/user/status/1368236350948970499	At Yankee Stadium, New Yorkers are waiting for vaccines in the middle of the night — and happy about it https://t.co/dAikmtPV9l	0
COVID-19	1363964279997743108	http://twitter.com/user/status/1363964279997743108	Vaccines work by triggering a response in a person's immune system. That means some people will feel a little sore, tired or unwell after their #COVID19 vaccination. Most side effects are mild and should not last longer than a week. More on the vaccine: https://t.co/6ePOXYDfmG https://t.co/8ShpaFXMwn	0
COVID-19	1363354245576220672	http://twitter.com/user/status/1363354245576220672	Today the Australian Government launched Australia’s COVID-19 vaccination program, with the first vaccinations held in Sydney. More details on the rollout of safe and effective COVID-19 vaccines is here: https://t.co/svQSOy6dDv https://t.co/QJ455hAyOg	0
COVID-19	1370050585924354053	http://twitter.com/user/status/1370050585924354053	@LauraWBush and I are grateful to have been vaccinated against COVID-19. These safe and effective vaccines are our way out of this pandemic and toward recovery and renewal. So when it’s your turn, roll up your sleeve and do your part. -President Bush @AdCouncil @TheCovidCollab https://t.co/orCWMWtZ6C	0
COVID-19	1368885882707578885	http://twitter.com/user/status/1368885882707578885	The first batch (1.1 million) AstraZeneca COVID-19 vaccines arrived in Indonesia today under the global vaccine-sharing scheme Covax Facility, co-led by WHO and global vaccine alliance. Indonesia is looking to secure at least 13.7 million doses of AstraZeneca vaccines. https://t.co/JRyiC4ZFkN	0
COVID-19	1368474007578742786	http://twitter.com/user/status/1368474007578742786	We have transported and delivered the first batch of COVID-19 Vaccines to Ethiopia. The shipment has arrived today and delivered to the Ethiopian MoH in a ceremony held in our cargo terminal. We will keep on providing this mission-critical service to save lives. #FlyEthiopian https://t.co/yx3XtNq0JR	0
COVID-19	1369517118970982400	http://twitter.com/user/status/1369517118970982400	During the past two weeks, UNICEF and partners have delivered over 15 million COVID-19 vaccine doses to countries through COVAX. Together with @WHO, @GAVI and @CEPIVaccines, we're working to make vaccines available to everyone. https://t.co/IJq8DXs3MN	0
COVID-19	1367168699464040451	http://twitter.com/user/status/1367168699464040451	After a troop of eight western lowland gorillas got sick in January, San Diego Zoo staff received experimental COVID-19 vaccines to give to great apes in their care, including bonobos and orangutans https://t.co/TVTHQID8bK	0
COVID-19	1366958948641832963	http://twitter.com/user/status/1366958948641832963	COVID-19 vaccines have arrived in 🇰🇪 - a fantastic day! Hongera to all who made this happen @MoH_Kenya, @gavi, @WHOKenya, @UNICEF, @CEPIvaccines. We played our part - KES 84 billion to COVAX, a 🇰🇪 🇬🇧 Health Partnership, and science 🧬 between @KEMRI_Kenya &amp; @OxfordVacGroup. https://t.co/00JexjoOAa	0
COVID-19	1367813077949964288	http://twitter.com/user/status/1367813077949964288	Angola 🇦🇴 Côte d'Ivoire 🇨🇮 Ghana 🇬🇭 Kenya 🇰🇪 Nigeria 🇳🇬 Rwanda 🇷🇼 Have all started rolling out COVID-19 vaccines this week through #COVAX - starting with health workers, teachers and people most at risk. @UNICEFSupply @WHO @gavi @CEPIvaccines https://t.co/DEmX5c182W	0
COVID-19	1368825655627046912	http://twitter.com/user/status/1368825655627046912	The Secretary to the Government of the Federation (SGF), Mr Boss Mustapha and members of the Presidential Task Force on COVID-19 will receive their doses of the Oxford-AstraZeneca COVID-19 vaccines today, the SGF Office has said in a statement.	0
COVID-19	1370098291627585537	http://twitter.com/user/status/1370098291627585537	Everyone in Wisconsin 16 and older will be eligible for COVID-19 vaccines in May, DHS deputy secretary Julie Willems Van Dijk says in a press briefing.	0
COVID-19	1367611051618033665	http://twitter.com/user/status/1367611051618033665	Teachers and staff in pre-K-12 schools and childcare programs under age 50 can receive a vaccine at a @kroger, @Walmart and @meijer. Teachers 50+ can be vaccinated anywhere in the state. Visit https://t.co/cfAuXPLaoM to find an eligible location. https://t.co/qLFvpkQLGF https://t.co/vav0D2QtbQ	0
COVID-19	1366473416115683339	http://twitter.com/user/status/1366473416115683339	New data shows that both the @Pfizer_UK and @AstraZeneca vaccines are highly effective in reducing COVID-19 infections among people aged 70 years and over. Watch Deputy Chief Medical Officer Professor Jonathan Van Tam explain 👇 Find out more: https://t.co/OTILiGq5pj https://t.co/gtjjCxzgz1	0
COVID-19	1357833978363998213	http://twitter.com/user/status/1357833978363998213	The messenger RNA technology that developed a successful #covid19 vaccine could serve as the solution for HIV, sickle cell, and malaria vaccines. https://t.co/jFwOlSOJKZ	0
COVID-19	1368144894305263617	http://twitter.com/user/status/1368144894305263617	Tonight, Fiji received 12,000 doses of the AstraZeneca COVID-19 vaccine through #COVAX. No nation can be safe from this virus until we all are. That is why we are working to secure more safe and effective COVID-19 vaccines and secure our people's place in the world's recovery. https://t.co/y24kZZbOG4	0
COVID-19	1370071438980448260	http://twitter.com/user/status/1370071438980448260	From a public health perspective, it is completely ridiculous and counterproductive to charge people for Covid-19 vaccines. That's why all countries (except India) are providing it free to residents. https://t.co/rAyK6WuTpA	0
COVID-19	1370181780284698624	http://twitter.com/user/status/1370181780284698624	President Biden says they’ve made plans to buy an additional 100M COVID-19 vaccines and expect to have enough vaccine for all adults by the end of May.	0
COVID-19	1366435057343352833	http://twitter.com/user/status/1366435057343352833	Today the first University of Oxford/AstraZeneca vaccinations have been taking place in Côte d'Ivoire, helping to protect vulnerable people from COVID-19. The UK has pledged £548m to COVAX, which is working to deliver vaccines to 92 low and lower-middle income countries. https://t.co/W0rKgCyLZB	0
COVID-19	1367271180160405507	http://twitter.com/user/status/1367271180160405507	I’m feeling great 24 hours after taking my second dose of COVID-19 vaccine. These vaccines are safe and effective and are how we'll get past this pandemic. When you're eligible, get your vaccine and do your part to beat COVID-19. #lagov https://t.co/JRJ1tj9AyQ	0
COVID-19	1363386810060050433	http://twitter.com/user/status/1363386810060050433	SBS has today released videos in more than 60 languages, including AUSLAN, informing communities about Australia’s COVID-19 vaccination roll-out plan, how vaccines work and how they are approved in Australia. #VaccineAustralia #COVID19 https://t.co/8fRsVxs1ND https://t.co/Wf8cwZUdpn	0
COVID-19	1370692800497467393	http://twitter.com/user/status/1370692800497467393	A new vaccine partnership agreed between the United States, Japan, India and Australia plans to flood Asian and Pacific island nations with “at least” 1 billion Covid vaccine doses by 2022 https://t.co/dqDsnRs9M9	0
COVID-19	1368941922018942977	http://twitter.com/user/status/1368941922018942977	The more Covid spreads globally, the more it will mutate into strains that are more infectious, more deadly, and more resistant to vaccines. We agree with @SenBooker: To truly end the pandemic, Biden must take bold steps to ramp up global vaccine access. https://t.co/ZJG3zipdkc	0
COVID-19	1369247283091566599	http://twitter.com/user/status/1369247283091566599	Note; “COVID-19 vaccines are very safe with high efficacy, particularly in preventing severe disease, hospitalization and death” ~ Dr. Phionah Atuhebwe #COVIDVaccinationUG #mohdelivers	0
COVID-19	1370842636089765897	http://twitter.com/user/status/1370842636089765897	President Biden, under intense pressure to donate excess coronavirus vaccines to needy nations, moved to address the global shortage in another way — by partnering with Japan, India and Australia to expand global vaccine manufacturing capacity https://t.co/nyDxDEde8A	0
COVID-19	1369037738880741379	http://twitter.com/user/status/1369037738880741379	Men and women tend to respond differently to many kinds of vaccines, including the Covid-19 vaccines. Researchers say it is probably because of a mix of factors, including hormones, genes and the dosing of the shots. https://t.co/ZqAskWgJVB	0
COVID-19	1367574018451210240	http://twitter.com/user/status/1367574018451210240	In good news, the US 7-day average of vaccines administered has exceeded 2 million for the first time and is only increasing. https://t.co/bWkDHsluCY https://t.co/Yf7bx7nwEV	0
COVID-19	1365683864602087435	http://twitter.com/user/status/1365683864602087435	The United States, the wealthiest nation in the world, with the highest number of Covid-19 deaths — now over half a million — should be leading the charge to share life-saving vaccines and treatments around the globe. https://t.co/tw2yy0ayAU	0
COVID-19	1365618698388660227	http://twitter.com/user/status/1365618698388660227	🇬🇭🇨🇮 Ghana and Ivory Coast are the first nations in the world to receive Covid-19 vaccines through Covax. The global vaccine equity scheme aims to provide at least 2 billion doses to lower-income countries https://t.co/HiwwzPGMdK https://t.co/gVKroXYFDu	0
COVID-19	1371061216131567618	http://twitter.com/user/status/1371061216131567618	Africa needs access to Covid-19 vaccines, in sufficient quantities, quickly and at affordable prices.@EmmanuelMacron @AUC_MoussaFaki @CyrilRamaphosa @BillGates @KGeorgieva @NOIweala @antonioguterres @POTUS @PaulKagame @DrTedros @AbiyAhmedAli @KamalaHarris @AminaJMohammed	0
COVID-19	1368565129583935489	http://twitter.com/user/status/1368565129583935489	Thank you to the Government of India for the donation of the 100,000 doses of the AstraZeneca vaccine. The vaccines arrived this afternoon and is a boost to our COVID-19 Vaccination exercise that will start on 10 March 2021. https://t.co/ka3lcWG6TW	0
COVID-19	1370142489764528128	http://twitter.com/user/status/1370142489764528128	Pfizer and BioNTech will exceed their original global target for COVID-19 vaccines by as much as 20% this year, Pfizer Chief Executive Albert Bourla told @Reuters https://t.co/HJoIm8X8V0 https://t.co/Jy0RZok8Sk	0
COVID-19	1369577517435269122	http://twitter.com/user/status/1369577517435269122	You may experience side effects after your #COVID19 vaccine. This is because vaccines work by triggering a response in a person's immune system. Most side effects are mild and only last a short time. More on the vaccine: ▶️ https://t.co/6ePOXYDfmG https://t.co/xb666J4Gcn	0
COVID-19	1367999546903650304	http://twitter.com/user/status/1367999546903650304	It was just this week that we found out the Johnson &amp; Johnson vaccine was approved. Now on Friday, those vaccines are going into Minnesotans’ arms.   To the @Vikings team who stepped up and set up a vaccination site in record time, thank you. Fighting COVID is a team effort. https://t.co/JM0gTZX8N6	0
COVID-19	1366169316115296256	http://twitter.com/user/status/1366169316115296256	JJ vaccine does what Moderna and Pfizer do - it keeps you protected from severe Covid and prevents hospitalization and death. When my patients ask me which vaccine to take, trust that I’ll be telling them to take any of the three vaccines they can get.	0
COVID-19	1370496908574199809	http://twitter.com/user/status/1370496908574199809	Great to be at Concordia Lutheran Church in Brevard County to announce an additional vaccination site that will provide 4,000 Johnson &amp; Johnson vaccines over four days to seniors age 65 and older. More here - https://t.co/Jg3GSFCvuX https://t.co/HHPMLGrXZA	0
COVID-19	1370275496982941696	http://twitter.com/user/status/1370275496982941696	I see that #AstraZeneca paid a lot to #media but truth is that their vaccine as all COVID-19 #vaccines are unproved and may or may not prevent COVID-19. https://t.co/B7PGAyudn0 Evidence in my blog. Rest is propaganda loves. If someone says opposite he/she is paid to state it. https://t.co/tC5vZGYB7t	1
COVID-19	1369505827774734336	http://twitter.com/user/status/1369505827774734336	Alaska makes vaccines available to those 16 and older, becoming 1st state to remove eligibility. The state has become a leader in quickly vaccinating its residents, benefiting from relationships with tribal health organizations. requirements https://t.co/ZIgp9on2AW	0
COVID-19	1367133935474515971	http://twitter.com/user/status/1367133935474515971	Dr. Ashish Jha says on @the_herald podcast "we now have a pretty high degree of certainty" that Covid vaccines reduce transmission and says his best guess is that they reduce transmission by 70-90%. https://t.co/Gf1Yxen5pf	0
COVID-19	1369746723531264004	http://twitter.com/user/status/1369746723531264004	South Africa, India, and more than 100 other nations have called on the World Trade Organization to temporarily waive patents for COVID-19 vaccines https://t.co/vxEn8RURWr https://t.co/ULseR92LMf	0
COVID-19	1367295358154403840	http://twitter.com/user/status/1367295358154403840	The FDA set a goal for Covid-19 vaccines trials of an efficacy rate of at least 50% and a confidence interval lower bound of no lower than 30%. Here are efficacy confidence intervals from major coronavirus vaccine trials. https://t.co/N1it9ZKnQW https://t.co/yWtdaiLS0l	0
COVID-19	1364978735116599299	http://twitter.com/user/status/1364978735116599299	Creating the foundation today to address challenges of tomorrow: we’re evaluating a 3rd dose of our #COVID19 vaccine against current &amp; new variants. We’re also discussing regulatory pathways similar to that of the flu vaccine to adapt vaccines if needed. https://t.co/13moUoWmvO	0
COVID-19	1368902758770806788	http://twitter.com/user/status/1368902758770806788	BREAKING: The Richmond and Henrico Health Districts today will begin registering people in the rest of Phase 1B for COVID-19 vaccines, including those 16-64 with pre-existing conditions.	0
COVID-19	1367838067537702921	http://twitter.com/user/status/1367838067537702921	This month, two of Cuba's homegrown COVID vaccines, Soberana 02 and Abdala, will commence final-stage clinical trials and scale up production, with immunization of at-risk groups slated for late March. https://t.co/zS1P3H4NYk https://t.co/zOUKDNg19Q	0
