topic	tweet_id	tweet_url	tweet_text	class_label
COVID-19	1363195522740334592	http://twitter.com/user/status/1363195522740334592	Brooklynites: If you live in one of the zip codes below and are eligible for the COVID vaccine, there are (as of 2/20 1:30pm) still a ton of appointments available at new Medgar Evers College vaccination site! Make appt at: https://t.co/L4ECc1empb #COVIDVaccine #GetVaccinated https://t.co/azmw1nOO4z	0
COVID-19	1362073776092041221	http://twitter.com/user/status/1362073776092041221	$ATOS two major strong pipelines/catalyst in play with vaccines being overwhelming around the world and it may take many many more months to get back to normal (covid-19 Nasal Spray and Breast cancer ) https://t.co/M0i1kXUIhT	1
COVID-19	1371089983344410626	http://twitter.com/user/status/1371089983344410626	Vaccine providers in Central Texas are getting their first shipments of the Johnson &amp; Johnson COVID-19 vaccine this week. It’s the third one to get approval in the U.S. — and it works a little differently than the Moderna and Pfizer vaccines. Here's how: https://t.co/J0CGHI4pcM	0
COVID-19	1371033936017686532	http://twitter.com/user/status/1371033936017686532	The US, Japan and Australia have decided to manufacture Covid-19 vaccines in India. The informal strategic forum known as the 'Quad' that aims to counter China’s growing influence in the Asia-Pacific region. https://t.co/o5c6aHMi2x	0
COVID-19	1370872303756578816	http://twitter.com/user/status/1370872303756578816	A COVID-19 outbreak has been declared at a Langley glass factory and Fraser Health says it is offering on-site vaccines to the factory workers. https://t.co/2sMRM5YdLa	0
COVID-19	1370797121994162183	http://twitter.com/user/status/1370797121994162183	Meet Sean, a registered nurse who received one of the first COVID-19 vaccines in the county. When we asked him why, he replied: “For the safety of myself, my husband, and my friends.” https://t.co/AtiMdGrtr2	0
COVID-19	1370737161553784836	http://twitter.com/user/status/1370737161553784836	Like so much of the government response to COVID-19, the rollout of vaccines has been beset by poor planning and bad management. https://t.co/0XBsFB5UZO	0
COVID-19	1370706206885486594	http://twitter.com/user/status/1370706206885486594	The British Society for Immunology will be holding a webinar for healthcare workers on engaging with ethnic minority communities on Covid-19 vaccines on Monday 15th March at 12pm. Find out more and book your place here: https://t.co/G2HY6R7d1T	0
COVID-19	1370676693963173889	http://twitter.com/user/status/1370676693963173889	🚨#China will facilitate visa application for those who have been inoculated with COVID-19 vaccines produced in #China and obtained the vaccination certificate. BUT! The vaccine is NOT a mandatory for visa application. Details: https://t.co/bbDVIGg9SR https://t.co/RlRhTW1UHB	0
COVID-19	1370525540772315138	http://twitter.com/user/status/1370525540772315138	All you seem to hear about in #Alberta is how well we are doing with #COVID19 &amp; Vaccines nothing about children and Covid. Below is daily average infection rate Jan 25/20 -Dec 18/20 17109cases /327days =52 kids/day Dec 19/20 -Mar 12/21 10572 cases/84 days= 126 kids/day https://t.co/pb3XmW4BPY	0
COVID-19	1370479234293071888	http://twitter.com/user/status/1370479234293071888	Thank you to @MillikenandCo for hosting our first COVID-19 vaccination drive today for SCMA members in the Spartanburg area and to @MUSChealth for providing the vaccines to 2,000 SC manufacturing workers! #TeamSC https://t.co/s6bdmoG5GZ	0
COVID-19	1370473928431443975	http://twitter.com/user/status/1370473928431443975	An Oregon researcher recently found a new COVID-19 mutation in Marion County. It's more deadly and more contagious than what the U.S. has been dealing with, but vaccines work well against it. https://t.co/tbQqX6RQFk	1
COVID-19	1370465753212854276	http://twitter.com/user/status/1370465753212854276	How one Latina’s search for a COVID-19 vaccine became a bureaucratic nightmare. A lot of Latinos are afraid to get the vaccines. And having these problems with everything—call here, call there, get put on the list—ugh, no way!” https://t.co/1tyTDxv3hB by @JoeyPeters.	0
COVID-19	1370452790577860609	http://twitter.com/user/status/1370452790577860609	Virginia Republicans Amanda Chase, Pete Snyder, Glenn Youngkin, and Kirk Cox are opposing: ➡️ $2 billion to help reopen schools ➡️ $1400 stimulus checks for struggling Virginians ➡️ Small business relief ➡️ Funding for additional vaccines #VAGov https://t.co/gbqAePS9SV	0
COVID-19	1370438735473606662	http://twitter.com/user/status/1370438735473606662	UK, US, and EU blocked a push by India and South Africa at WTO to waive patent rights in an effort to boost production of COVID-19 vaccines for poor nations. The notion was supported by 80 developing countries, but opposed by all Western countries. https://t.co/Sq6nDwjwFE	1
COVID-19	1370422536278831110	http://twitter.com/user/status/1370422536278831110	QAnon is now focused on #COVID19 vaccine conspiracies and planning a “World Wide Rally For Freedom” on March 20 involving global protests against pandemic health restrictions. https://t.co/hb9LZeute7	0
COVID-19	1370409992659070982	http://twitter.com/user/status/1370409992659070982	Both the @PfizerBioNTech and @moderna_tx COVID-19 vaccines are #mRNA based. Find out more about what mRNA is and how it was used to make these vaccines in our COVID-19 Vaccine Q&amp;A Pamphlet for Older #Canadians in partnership with @RyersonNIA https://t.co/62Cw6XhVU6 https://t.co/F4L3uegMVj	0
COVID-19	1370400479235149828	http://twitter.com/user/status/1370400479235149828	The race to end the pandemic is on, and UNICEF is playing a vital role in the equitable global distribution of lifesaving COVID-19 vaccines. Here's the latest on a busy week for the COVAX initiative. #EndThePandemic https://t.co/X6YgYKoYzI	0
COVID-19	1370388420711702529	http://twitter.com/user/status/1370388420711702529	IN PHOTOS | The initial supplies of AstraZeneca #Covid-19 vaccines for Negros Occidental and Bacolod City arrive at the Bredco Port in Bacolod City on Friday (March 12, 2021) afternoon. | via @nguadalquiver | 📷 NegOcc-PIO #ResBAKUNA #BIDASolusyon+ https://t.co/iXVBM7dQ3Z	0
COVID-19	1370382956632576000	http://twitter.com/user/status/1370382956632576000	In Scotland, a single dose of Pfizer’s vaccine was 85 per cent effective at reducing COVID-19 hospitalisations; AstraZeneca’s vaccine did even better. https://t.co/oCNwNuZLw0 https://t.co/dXGX4kMnlE	1
COVID-19	1370367865061306369	http://twitter.com/user/status/1370367865061306369	NEW: In a letter obtained by Insider, @SenDuckworth and 10 others push the Biden admin to quickly address the inequalities in COVID-19 vaccine distribution as wealthier and white people who are less impacted snag a disproportionate number of the shots. https://t.co/MO4KpwRLt6	0
COVID-19	1370354846189154307	http://twitter.com/user/status/1370354846189154307	UK, US and EU have blocked S Africa and India’s proposal to waive intellectual property protections on COVID-19 vaccines and treatments at the WTO general council meeting. colonial logic go brrr	1
COVID-19	1370328733400326144	http://twitter.com/user/status/1370328733400326144	Dr Tehseen Khan explains that the COVID-19 vaccines do not contain pork products or any animal products. The vaccines are safe and the most effective way to prevent you getting ill from coronavirus. Make sure you get your COVID-19 vaccine when it is your turn. #KeepLondonSafe https://t.co/n8a2BiifdD	0
COVID-19	1370317379792691204	http://twitter.com/user/status/1370317379792691204	The #bizhumanrights issue: WTO fails to waive any intellectual property rights for vaccines and treatments related to COVID-19. https://t.co/jojdWldDDY	1
COVID-19	1370281114628149250	http://twitter.com/user/status/1370281114628149250	They told you vaccines were 100% safe and 95% effective. They lied. The EMA covid-19 data leak, and what it tells us about mRNA instability https://t.co/m0LURlgOke	1
COVID-19	1370269804616155136	http://twitter.com/user/status/1370269804616155136	A local couple who met and got engaged at Fenway 50 years ago returned for their COVID-19 vaccines https://t.co/a57j3oOznd https://t.co/hkyaNJM0Ne	0
COVID-19	1370246342690361346	http://twitter.com/user/status/1370246342690361346	Deputy President David Mabuza said the government had put in place measures to prevent corruption and wasteful expenditure in the procurement and distribution of Covid-19 vaccines. https://t.co/Y6w6yRsm8s	0
COVID-19	1370188900090540033	http://twitter.com/user/status/1370188900090540033	Received vaccines as an infant, to start school, boosters during school, vaccines to go on a mission, and once a month on my mission... a flu shot now every year. It’s what we do to stay safe. Please just get your COVID vaccine. 👊❤️💉	0
COVID-19	1370168272319094785	http://twitter.com/user/status/1370168272319094785	NEW:There have been reports of snags, delays and cancellations of COVID-19 vaccines for U.S. troops stationed abroad. In particular at Landstuhl Regional Med. Center in Germany where a post says it would be cancelling appts for first and in some cases second doses of the shot	0
COVID-19	1370159407368007680	http://twitter.com/user/status/1370159407368007680	We're pleased to see the Australian Government @healthgovau have specifically listed #MND as a priority underlying medical condition for Phase 1b of the #COVID19 vaccine rollout ⤵️ More info: https://t.co/bQ2MW6CJ6P https://t.co/i6wKRAB5au	0
COVID-19	1370132844262096897	http://twitter.com/user/status/1370132844262096897	This --&gt; It’s very obvious that distribution of vaccines favors wealthier, whiter Marylanders, and Hogan doubling down on his dismissal of an easily identifiable fact is a dangerous failure of leadership. https://t.co/uUJF6Fwe8Y	0
COVID-19	1370115832349605899	http://twitter.com/user/status/1370115832349605899	Introducing TeleGov, a #digitalgovernment tool making appointment scheduling easy for a growing number of agencies in the U.S. Using @Microsoft tech, the SaaS solution is already used in 8 states for DMV services, #COVID19 vaccines and more. Learn more: https://t.co/9G9vSYSyTl https://t.co/0auozgTPj6	0
COVID-19	1370035256162652161	http://twitter.com/user/status/1370035256162652161	Monitoring adverse reactions following immunisation is essential, particularly for new vaccines such as those against COVID-19. We describe 20 cases of acute onset of a single supraclavicular lymphadenopathy manifesting between 24 h and 9 days after ipsilateral intramuscular 2/x	0
COVID-19	1370021633994289163	http://twitter.com/user/status/1370021633994289163	🚨Italy, Norway and Denmark stop giving AstraZeneca Covid Vaccine over blood clot fears. https://t.co/oXDgcfiaab #Covid #Covid19 #CovidVaccine #Coviduk #Lockdown3 #Lockdown2021 #Lockdown #BorisJohnsonOut #Coronavirus #Vaccine #VaccinePassports #mRNA #Italy #Denmark #Norway	0
COVID-19	1370019277173063681	http://twitter.com/user/status/1370019277173063681	By getting a #COVID19 vaccine, you are protecting yourself, your family, and your community. Here are 6 things you need to know about the COVID-19 vaccines. @mcicpa https://t.co/f2A775DGTx	0
COVID-19	1370012890753871874	http://twitter.com/user/status/1370012890753871874	SNP MP Chris Stephens has tabled an Early Day Motion in the House of Commons supporting the campaign by @TPTgeneral, @RNIB and @guidedogs to ensure that Covid-19 vaccines and testing are accessible. https://t.co/koEkaeZ83c	0
COVID-19	1370002567841857539	http://twitter.com/user/status/1370002567841857539	A year later, the World Health Organization is still struggling to keep on top of the evolving science of COVID-19, to persuade countries to abandon their nationalistic tendencies and help get vaccines where they're needed most. https://t.co/uZxYnRZJxz	0
COVID-19	1369995783781576704	http://twitter.com/user/status/1369995783781576704	IOC and China partner to offer COVID-19 vaccines for Tokyo and Beijing Olympians https://t.co/RpRJB5DZjy	0
COVID-19	1369992428720168963	http://twitter.com/user/status/1369992428720168963	On this day 2020: @WHO declared #COVID19 a pandemic. Take a look at the resources we’ve collated about #LongCovid, vaccines, and infection prevention and control https://t.co/4IZQ262GQX https://t.co/S0uwbAIyfL #GlobalPT @AWcpta @ERWorldPhysio @WorldPhysioNACR @WorldPhysioSAR https://t.co/WdJGkismZo	0
COVID-19	1369956030633902082	http://twitter.com/user/status/1369956030633902082	On this day last year @WHO declared Covid-19 a pandemic. And yesterday @BarrowPresident &amp; partners launched vaccination campaign as part of efforts to help end it. Vaccines are safe, effective &amp; save lives. We encourage all those eligible to get vaccinated. #VaccinesWork https://t.co/minWCp3nsM	0
COVID-19	1369938573798088706	http://twitter.com/user/status/1369938573798088706	These aforementioned hospitals have no vaccines left on day 11 of the phase 2 Covid-19 vaccine rollout!! And all this while the cases in Kalyan-Dombivli are rapidly rising. Truly pathetic. @KDMCOfficial @CMOMaharashtra @DrRahulGhule11 @AmhiDombivlikar	0
COVID-19	1369913493583958016	http://twitter.com/user/status/1369913493583958016	US, Japan &amp; others are planning announce financing agreements to increase manufacturing capacity of COVID-19 vaccines in India. The focus is on getting Indian companies &amp; institutions to manufacture vaccines for US companies Novavax and Johnson &amp; Johnson. https://t.co/tN28J1ytmB	0
COVID-19	1369813958618734593	http://twitter.com/user/status/1369813958618734593	@Angry_Staffer Fixed it: Hope everyone remembers when they're getting the Covid-19 (referred to as Trump Virus) Vaccine, that when #TheFormerGuy was President, he failed the country and allowed 500,000 + deaths. Biden came in and saved the day....got us vaccines and COVID relief. Remember	0
COVID-19	1369776341193744392	http://twitter.com/user/status/1369776341193744392	@MartinCo8256 @TinFoilAwards @GRHutchinson @MadyWaterer Here you go. Click on each link for Pfizer and AZN and you will see the deaths and injuries from the vaccine. Reports are 7 days old but 472 deaths from the vaccines is unacceptable! Many more will have life long injuries. https://t.co/ocPtnDfHQ6	1
COVID-19	1369769974022107137	http://twitter.com/user/status/1369769974022107137	We know many Albertans are anxious to book COVID-19 vaccine appointments and get their immunizations. Although vaccine supply has been limited to date, there are multiple shipments of all vaccines coming in. https://t.co/W2tEE7rqUx	0
COVID-19	1369754629765033987	http://twitter.com/user/status/1369754629765033987	Returning from a break, Rep. Ami Bera (D-CA-7) brings up COVID-19 strategy and the upcoming US-India-Japan-Australia (Quad) Summit. Blinken responds, We have a Quad Summit meeting on Friday, and I expect we'll see something on vaccines coming out of that summit.	0
COVID-19	1369714476778483713	http://twitter.com/user/status/1369714476778483713	#COVAX was a historic initiative taken last year to buy vaccines on behalf of the whole world and make sure the doses were distributed fairly. It has become something much less... https://t.co/doJ3yXvlT3	0
COVID-19	1369700777284038658	http://twitter.com/user/status/1369700777284038658	A group of scientists has penned a letter to federal and provincial governments raising concerns and questions about delaying the second dose of COVID-19 vaccines https://t.co/PJcM3O4wwr https://t.co/l53UYJkDiS	0
COVID-19	1369682961424146442	http://twitter.com/user/status/1369682961424146442	Here's some simply terrific COVID-19 news. At KUMed we have the fewest number of positive patients since the very beginning and only two ICUs. Vaccines and discipline are working.	0
COVID-19	1369680346212663300	http://twitter.com/user/status/1369680346212663300	The innovative collaboration announced today will help to ensure that millions will have access to safe vaccines against #COVID19 and future infectious disease threats. - Minister Gould https://t.co/5fZmP4TIjd	0
COVID-19	1369649460968644612	http://twitter.com/user/status/1369649460968644612	Whole virus, protein subunit, viral vector and nucleic acid (RNA and DNA) = the four main types of #COVID19 vaccines. Here's how they work: https://t.co/VElwOQv4tj @gavi https://t.co/gljn8QDTdo	0
COVID-19	1369641732632088578	http://twitter.com/user/status/1369641732632088578	Despite being essential, agriculture workers are still not eligible for COVID-19 vaccines. @JuliaLeBlancNC9 speaks with industry leaders about it. #LocalSYR https://t.co/FGZvzMrC3b	0
COVID-19	1369604166398656514	http://twitter.com/user/status/1369604166398656514	The COVID-19 vaccination programme is well underway across Kirklees. Effective vaccines are one way to protect people from the virus, its vital that we continue to follow the guidelines #handsfacespace For more information visit 👉 https://t.co/fcxazFAPJJ https://t.co/2CY4bmthtq	0
COVID-19	1369599837533003782	http://twitter.com/user/status/1369599837533003782	Prof. Jaoko: All medicines and vaccines have side effects https://t.co/GvSvlWYEv7 https://t.co/DkD5B6WBAn	0
COVID-19	1369597662195032067	http://twitter.com/user/status/1369597662195032067	The Toronto Star vaccine gap tracker tracks the number of vaccines Ontario and Canada are administering everyday and what we need to be administering to meet stated goals: https://t.co/kFE9tGGEmT	0
COVID-19	1369595764268146689	http://twitter.com/user/status/1369595764268146689	India will supply Covid-19 vaccines to Pakistan through Covax, reports @IndianExpress. I had written in January on how Pakistan gets a bulk of its vaccines from India because importers say they are 'world-class and affordable'. https://t.co/TOuWXQJpCf #India #Pakistan #vaccines	0
COVID-19	1369577901285208065	http://twitter.com/user/status/1369577901285208065	South Australians living with disability and frontline support staff in State Government-run disability accommodation have begun receiving COVID-19 vaccines. Info https://t.co/jIAIf69zrz #rollupSA @SAHealth https://t.co/WfImQmph96	0
COVID-19	1369547503293579265	http://twitter.com/user/status/1369547503293579265	Both the #PfizerBioNTech and the #OxfordAstraZeneca COVID-19 vaccines have been shown to be extremely safe and effective, which is great news for all Australians.	0
COVID-19	1369487000143880195	http://twitter.com/user/status/1369487000143880195	Manufacturing capacity and ingredients shortages are the main bottlenecks to expanding COVID-19 vaccine production, several global drug groups said on Tuesday, not patents that some critics are demanding be removed.​ https://t.co/wpddXFnZGD	0
COVID-19	1369431050661793795	http://twitter.com/user/status/1369431050661793795	People who have severe heart defects, Type 1 diabetes, cerebral palsy, cystic fibrosis and intellectual disabilities are now eligible for the vaccine. https://t.co/8WGDWe9dVM	0
COVID-19	1369420514993844225	http://twitter.com/user/status/1369420514993844225	A quick vaccine rollout “is the best way to cover lost economic ground,” Albay Rep. Joey Salceda, the House tax panel chief, said on Tuesday and urged the government not to rely on donations alone for the COVID-19 vaccines. https://t.co/u08gAQzyO4	0
COVID-19	1369406215743275009	http://twitter.com/user/status/1369406215743275009	This dude spent all of 2020 telling everyone that COVID-19 is overblown and is now peddling garbage about the vaccines. It's almost like he's rooting for the virus. https://t.co/GsglGd7yJU	0
COVID-19	1369369590145355782	http://twitter.com/user/status/1369369590145355782	Even Pakistanis are getting Covishield and Govt is pushing Covaxin to the guinea pigs of India Pakistan to get 45 million doses of Made in India COVID-19 vaccines in March: Report https://t.co/UWjt64YGZ4	0
COVID-19	1369352034311364620	http://twitter.com/user/status/1369352034311364620	To our central Florida veterans. The Orlando VA is offering Covid-19 vaccines for ALL veterans who receive care at a VA regardless of age at the Lake Nona &amp; the Lake Baldwin VA. They are taking both walk-ins and appointments 407-631-0499. https://t.co/pdbsNpMB4d	0
COVID-19	1369309740921200643	http://twitter.com/user/status/1369309740921200643	We need to have a serious look at the so calledHigh Level Task Force who had the job to ensure we have enough vaccines and failed ⁦⁦@EwanMacKenna⁩ ⁦@marktigheST⁩ Covid-19 vaccine plan has changed 17 times due to supply shortfalls https://t.co/8lG4Ek4Q4D	0
COVID-19	1369286437418512385	http://twitter.com/user/status/1369286437418512385	The CDC's VAERS database list 236 vaccines. The 2 COVID vaccines (Moderna and Pfizer) rank 3 and 4 in number of deaths reported after getting the vaccine. https://t.co/Oz6VpvcH2r Only particular polio and pneumonia vaccines have more deaths. And not that many more. https://t.co/kAriQ1E5Uj	1
COVID-19	1369275796905488388	http://twitter.com/user/status/1369275796905488388	Today from 10 am - 3 pm, The City of Chicago and Jewel-Osco will be distributing COVID-19 Vaccines in West Pullman for Seniors 65 and older. Please refer to the flyer to see how to sign up for an appointment time. https://t.co/LKiKU5jToL	0
COVID-19	1369273661086138374	http://twitter.com/user/status/1369273661086138374	The pause that followed meant more than 28,000 mostly avoidable cases were reported in 1955. The incident caused deep misgivings and still fuel anti-vaxxers today. It also kept large pharmaceutical firms away from vaccines https://t.co/hcfnNj7acd https://t.co/s7lJeXwlbV	0
COVID-19	1369266467447963653	http://twitter.com/user/status/1369266467447963653	UK AvonCAP study shows reduced risk of COVID-19 hospitalisations after COVID-19 vaccines among people aged ≥ 80 and older, including frail elderly people with extensive comorbid disease Read https://t.co/3ZwmqHIVCp #CovidVaccine #HoldFirm https://t.co/BA00rsMK7W	0
COVID-19	1369262035742191625	http://twitter.com/user/status/1369262035742191625	#Israel almost fully reopened on Sunday from its #COVID lockdown with a party. What life looks like on the other side of the vaccines, my dispatch from the nightlife of Tel Aviv - and hopefully the future @thedailybeast https://t.co/v2VFTpcrUP	0
COVID-19	1369125211103240193	http://twitter.com/user/status/1369125211103240193	1. The flu vaccine is only semi-effective. It helps reduce, but does not eliminate the flu. COVID vaccines are more effective. 2. If everyone took it, it would reduce cases significantly. 3. COVID is much more contagious, and 15-25x as deadly as the flu. https://t.co/ehLpEHX4cc	1
COVID-19	1369100913294606336	http://twitter.com/user/status/1369100913294606336	Fury as Germany and Italy sit on MILLIONS of unused Covid jabs while EU blocks AstraZeneca vaccine exports https://t.co/q30cM6YgVz	1
COVID-19	1369046284481486852	http://twitter.com/user/status/1369046284481486852	A report finds 4 publications with ties to Russia have targeted Western-made COVID-19 vaccines with misleading coverage of risks and side effects. https://t.co/o14spdhjUs	1
COVID-19	1369013023638249473	http://twitter.com/user/status/1369013023638249473	Denmark Twitter: Austria and Denmark team up with Israel for next generation COVID-19 vaccines Austria and Denmark have teamed up with Israel to produce 2nd generation vaccines against new mutations of the coronavirus. The alliance, dubbed First Movers https://t.co/Ih1uLTO9vC	0
COVID-19	1369001295928033296	http://twitter.com/user/status/1369001295928033296	Toronto has launched its own website and hotline for booking COVID-19 vaccines as it waits for a provincial system to make its debut. https://t.co/MKn50aNYCb	0
COVID-19	1368992594215206915	http://twitter.com/user/status/1368992594215206915	Thank you to @typewriterninja for an excellent story in @USATODAY on the work the @dsamn has been doing to ensure those with Down Syndrome and their caregivers have equal access to vaccines in Minnesota. #earnedmedia #clientnews #healthequity https://t.co/mW9FwnQFeQ	0
COVID-19	1368989396943462400	http://twitter.com/user/status/1368989396943462400	Survey shows primary care is willing to distribute COVID-19 vaccines widely and equitably @GreenCenterOrg @PCPCC @x4_health #ophthalmology #covid19 https://t.co/Nf3WMGeRKQ	0
COVID-19	1368946623603240969	http://twitter.com/user/status/1368946623603240969	Guidance from the White House released this morning appears to have scrubbed a planned visit to #Baltimore by #POTUS - 'The President will host an event with the CEOs of Johnson &amp; Johnson and Merck about their historic partnership to produce more COVID-19 vaccines.' @wbalradio	0
COVID-19	1368861708719185926	http://twitter.com/user/status/1368861708719185926	Useful info from the @ONS. It’s clear that people are become increasingly upbeat about the COVID-19 vaccines. Overall positive vaccine sentiment was 94% in this survey - up from 78% in December. Younger adults and black adults reported more vaccine hesitancy than other groups. https://t.co/gdVt8vwPFg	0
COVID-19	1368673526501236746	http://twitter.com/user/status/1368673526501236746	Tony Fauci and the Swine Flu Hoax; Betrayal of Trust Covid-19 is not the first time that Fauci and the CDC have lied about an epidemic to push a dangerously rushed "vaccine" https://t.co/RiEpUrx32t #Covid19 #CovidVaccine https://t.co/iQrMpvWBQ8	1
COVID-19	1368593034611396608	http://twitter.com/user/status/1368593034611396608	Help a loved one book a COVID-19 vaccine. Starting March 8 seniors 90+ and Aboriginal Peoples 65+ are eligible. For more info visit: https://t.co/xHblSM6jHJ https://t.co/jJMe4OCyaV	0
